"asset_type","struct","field","offset","size","serialized_type","readiness","ps3_evidence","observed_values","xbox_correlation","notes"
"XModel","XSurface","PartBits","0x3C","0x18","uint32[6]","RESOLVED","EBOOT Load_XSurface 0x000FDA50 copies fixed 0x54 XSurface rows and does not chase child pointers after GfxIndexBuffer.DataOffset at +0x38. default_mp consumer 0x0011F718 and default consumer 0x000C3FA8 iterate surfaces with stride 0x54, copy +0x3C/+0x40/+0x44/+0x48/+0x4C/+0x50 as six dwords, then combine them with shifted bone/part masks for surface selection.","common_mp loads through all assets with XSurface.PartBits[6] and no Pad3C/Bytes40To53 carrier","Xbox default_mp map/PDB correlate XSurfaceVisitTrianglesInAabb, XSurfaceTraceLine, R_PreSkinXSurface, partBits, surfPartBits, and hidePartBits after PS3 stride/offset proof.","Opened as Bytes40To53; PS3 consumers prove the field starts at +0x3C and covers six dwords through +0x53."
"GfxMap","GfxWorldAsset","Unknown26C","0x26C","0x04","uint32","OPEN","EBOOT Load_GfxWorld 0x00112040 copies the 0x288-byte root and does not dispatch a child loader for +0x26C; tail child loaders begin at +0x274 after count +0x270.","mp_boneyard GfxWorld root: 0x035692D8","CODResearch MW2 GfxWorld tail is incomplete here; no PS3 consumer proof recorded yet.","Root byte is accounted for by model/load-stream copy but semantic meaning remains open."
"GfxMap","GfxWorldAsset","Unknown278","0x278","0x04","uint32","OPEN","EBOOT Load_GfxWorld 0x00112040 copies the 0x288-byte root and does not dispatch a child loader for +0x278; +0x27C is the size used by both +0x280 and +0x284 VIRTUAL payloads.","mp_boneyard GfxWorld root: 0x02000000","CODResearch MW2 GfxWorld tail is incomplete here; no PS3 consumer proof recorded yet.","Root byte is accounted for by model/load-stream copy but semantic meaning remains open."
"GfxMap","GfxPortal","Unknown20To21","0x20","0x02","byte[2]","OPEN","EBOOT Load_GfxPortal 0x000F4FB0 copies a 0x3C row, resolves vertices at +0x1C, and uses byte +0x22 as vertex count. Bytes +0x20..+0x21 are copied but no PS3 consumer proof has been recorded yet.","mp_boneyard pending GfxMap load logging","CODResearch MW2 GfxPortal names the surrounding writable, plane, vertices, vertexCount, and hullAxis fields but leaves these two bytes semantically unproven for PS3.","Accounted root-row bytes; revisit with renderer/portal consumers."
"GfxMap","GfxStaticModelInst","Unknown1CTo23","0x1C","0x08","byte[8]","OPEN","EBOOT Load_GfxWorldDpvsStatic 0x00111C98 loads GfxStaticModelInst rows through helper 0x000E3850 with stride 0x24; CODResearch-correlated mins/maxs/groundLighting account for +0x00..+0x1B only.","mp_boneyard pending GfxMap load logging","CODResearch MW2 GfxStaticModelInst lists mins, maxs, and groundLighting but does not account for the PS3 0x24 stride tail.","Accounted row bytes; needs PS3 static-model draw/lighting consumer proof."
"GfxMap","SrfTriangles","Unknown08","0x08","0x04","uint32","OPEN","EBOOT Load_GfxSurface 0x001102E8 copies each 0x1C-byte surface row and stores varMaterialHandle from surface +0x14 before calling the material pointer loader, proving the triangle substructure spans +0x00..+0x13 on PS3. default_mp consumer 0x0035e3e0 proves surrounding fields: +0x00 is added to worldDraw.vertexLayerData(+0x3C), +0x04 selects worldDraw.vertexData(+0x2C) in 0x10-byte vertices, +0x0E is triCount, and +0x10 selects worldDraw.indices(+0x4C). It does not read +0x08.","mp_boneyard first surface rows show +0x08 values like 0x00000028/0x00000008/0x00000024, while +0x0C packs plausible vertexCount/triCount pairs such as 0x0004/0x0002 and +0x10 advances like baseIndex 0, 6, 12.","CODResearch MW2 lists the surrounding srfTriangles_t names and GfxSurface material/lighting fields, but its 0x10-byte triangle shape conflicts with the PS3 +0x14 material-pointer offset, so +0x08 remains PS3-open. Xbox R_SetStreamsForBspSurface/R_DrawBspTris names are correlation only until the PS3 draw stream-binding consumer is matched.","Accounted surface-row bytes; PS3 0x0035e3e0 proves adjacent runtime buffer use but leaves +0x08 semantic meaning open."
"GameMapMp","G_GlassData","Pad14To7F","0x14","0x6C","byte[108]","RESOLVED","EBOOT Load_G_GlassData 0x00105D58 copies a fixed 0x80-byte root and only dispatches child loaders from +0x00 using count +0x04 and +0x10 using count +0x0C. default_mp/EBOOT structure-pattern scans produced only false positives; manual inspection found no confirmed consumer anchored to GameWorldMp.g_glassData or the loader-proven G_GlassData root tail.","mp_boneyard asset[322] observes 108 zero bytes in G_GlassData +0x14..+0x7F after correcting GfxWorld.dpvs.surfaceMaterials to RUNTIME and loading GameMapMp at source 0x2D1863B.","Xbox default_mp PDB TPI record G_GlassData type 0x9BDE has size 0x80/count 7 and member 6 named pad at +0x14. Its type 0x9BDC is LF_ARRAY elem T_UCHAR index T_ULONG size 108.","Former Unknown14To7CWords/Reserved14To7FWords; accounted as Xbox-correlated byte padding after PS3 fixed-root size and offset proof, not a runtime-state structure."
"ColMapMp","clipMap_t","UnknownD0ToFF","0xD0","0x30","byte[48]","OPEN","EBOOT Load_clipMap_t 0x00113458 copies the fixed 0x100 root and dispatches no child loader for +0xD0..+0xFF after checksum +0xCC; mp_boneyard.ff validates complete source coverage and typed offset pointer proof through ColMapMp asset[323].","mp_boneyard clipMap_t root source 0x2D1A1C3 has +0xD0..+0xFF all zero bytes.","CODResearch MW2 clipMap_t names this tail unknown5[0x30]; Xbox map/PDB exposes Load_clipMap_t/Mark_clipMap_t but no PS3-proven semantic consumer for the tail has been recorded.","Root bytes are owned by the model and loader. Keep UnknownD0ToFF until PS3/default_mp consumer evidence proves a stronger semantic name."
